{
  "plan": "opencode-go",
  "service": "opencode",
  "tier": "go",
  "price": "$10/mo",
  "models": {
    "fast": "opencode-go/deepseek-v4-flash",
    "default": "opencode-go/kimi-k2.5",
    "premium": "opencode-go/kimi-k2.6"
  },
  "agent_overrides": {
    "aphrodite": "opencode-go/qwen3.6-plus",
    "gaia": "opencode-go/deepseek-v4-pro",
    "apollo": "opencode-go/deepseek-v4-flash",
    "iris": "opencode-go/deepseek-v4-flash",
    "mnemosyne": "opencode-go/deepseek-v4-flash",
    "nyx": "opencode-go/minimax-m2.5",
    "talos": "opencode-go/deepseek-v4-flash"
  },
  "handoff_models": {
    "zeus__athena": "opencode-go/kimi-k2.6",
    "zeus__themis": "opencode-go/kimi-k2.6",
    "zeus__hephaestus": "opencode-go/kimi-k2.5",
    "zeus__chiron": "opencode-go/kimi-k2.5",
    "zeus__echo": "opencode-go/kimi-k2.5",
    "zeus__nyx": "opencode-go/minimax-m2.5",
    "zeus__mnemosyne": "opencode-go/deepseek-v4-flash",
    "athena__themis": "opencode-go/kimi-k2.6",
    "athena__zeus": "opencode-go/kimi-k2.6",
    "hermes__themis": "opencode-go/kimi-k2.6",
    "aphrodite__themis": "opencode-go/kimi-k2.6",
    "demeter__themis": "opencode-go/kimi-k2.6",
    "prometheus__themis": "opencode-go/kimi-k2.6",
    "hephaestus__themis": "opencode-go/kimi-k2.6",
    "hephaestus__prometheus": "opencode-go/kimi-k2.5",
    "chiron__themis": "opencode-go/kimi-k2.6",
    "chiron__prometheus": "opencode-go/kimi-k2.5",
    "echo__themis": "opencode-go/kimi-k2.6",
    "echo__talos": "opencode-go/deepseek-v4-flash",
    "nyx__zeus": "opencode-go/kimi-k2.5",
    "iris__zeus": "opencode-go/kimi-k2.6",
    "iris__mnemosyne": "opencode-go/deepseek-v4-flash",
    "apollo__zeus": "opencode-go/kimi-k2.5",
    "apollo__athena": "opencode-go/kimi-k2.5",
    "themis__zeus": "opencode-go/kimi-k2.5",
    "themis__mnemosyne": "opencode-go/deepseek-v4-flash",
    "talos__zeus": "opencode-go/kimi-k2.5"
  },
  "limits": {
    "monthlyRequests": null,
    "notes": "Usage cap across rolling windows"
  }
}
