{
  "plan": "copilot-free",
  "service": "vscode",
  "tier": "free",
  "price": "$0/mo",
  "models": {
    "fast": "openai/gpt-5-mini",
    "default": "openai/gpt-5-mini",
    "premium": "openai/gpt-5-mini"
  },
  "agent_overrides": {
    "themis": "anthropic/claude-sonnet-4-6",
    "zeus": "anthropic/claude-sonnet-4-6"
  },
  "limits": {
    "monthlyRequests": 50,
    "notes": "Only 50 premium requests total. GPT-5 mini and GPT-4.1 are free (0x multiplier). Premium models consume the 50-request pool."
  }
}
