{
  "plan": "claude-max-20x",
  "service": "claude",
  "tier": "max-20x",
  "price": "$200/mo",
  "models": {
    "fast": "anthropic/claude-haiku-4-5-20250514",
    "default": "anthropic/claude-sonnet-4-6-20250514",
    "premium": "anthropic/claude-opus-4-7-20250514"
  },
  "handoff_models": {
    "zeus__themis": "anthropic/claude-opus-4-6-20250514",
    "athena__themis": "anthropic/claude-opus-4-7-20250514",
    "hermes__themis": "anthropic/claude-opus-4-6-20250514",
    "aphrodite__themis": "anthropic/claude-opus-4-6-20250514"
  },
  "limits": {
    "monthlyRequests": null,
    "notes": "~900 messages per 5h window. 1M context Opus 4.6. Earliest access to new models."
  }
}
