{
  "plan": "copilot-enterprise",
  "service": "vscode",
  "tier": "enterprise",
  "price": "$39/user/mo",
  "models": {
    "fast": "anthropic/claude-haiku-4-5",
    "default": "anthropic/claude-sonnet-4-6",
    "premium": "anthropic/claude-opus-4-7"
  },
  "agent_overrides": {
    "apollo": "openai/gpt-5-mini",
    "aphrodite": "google/gemini-3.1-pro",
    "nyx": "openai/gpt-5.4-mini",
    "talos": "openai/gpt-5.4-mini",
    "iris": "anthropic/claude-haiku-4-5",
    "mnemosyne": "anthropic/claude-haiku-4-5"
  },
  "handoff_models": {
    "zeus__themis": "anthropic/claude-opus-4-6",
    "iris__zeus": "openai/gpt-5.3-codex"
  },
  "limits": {
    "monthlyRequests": 1000,
    "notes": "1000 premium requests/user/mo. Custom fine-tuned models available. GPT-5.3-Codex is LTS/base model (1x multiplier)."
  }
}
