{
  "plan": "copilot-pro-plus",
  "service": "vscode",
  "tier": "pro-plus",
  "price": "$39/mo",
  "models": {
    "fast": "openai/gpt-5-mini",
    "default": "anthropic/claude-sonnet-4-6",
    "premium": "anthropic/claude-opus-4-7"
  },
  "agent_overrides": {
    "apollo": "openai/gpt-5-mini",
    "aphrodite": "google/gemini-3.1-pro",
    "nyx": "openai/gpt-5.4-mini",
    "talos": "openai/gpt-5-mini",
    "iris": "openai/gpt-5-mini",
    "mnemosyne": "openai/gpt-5-mini",
    "gaia": "anthropic/claude-sonnet-4-6"
  },
  "handoff_models": {
    "zeus__themis": "anthropic/claude-opus-4-6",
    "zeus__mnemosyne": "openai/gpt-5.4-mini",
    "zeus__nyx": "openai/gpt-5.4-mini",
    "athena__themis": "anthropic/claude-opus-4-6",
    "iris__zeus": "openai/gpt-5.3-codex",
    "iris__mnemosyne": "openai/gpt-5-mini"
  },
  "limits": {
    "monthlyRequests": 1500,
    "notes": "1500 premium requests/mo. Full access to all models. Claude Opus 4.7 at 7.5x multiplier."
  }
}
