{
  "plan": "cursor-pro",
  "service": "cursor",
  "tier": "pro",
  "price": "$20/mo",
  "models": {
    "fast": "gpt-5-mini",
    "default": "claude-4.6-sonnet",
    "premium": "claude-4.7-opus"
  },
  "agent_overrides": {
    "apollo": "gpt-5-mini",
    "aphrodite": "gemini-3-pro",
    "nix": "gpt-5.4-nano",
    "talos": "claude-4.5-haiku",
    "iris": "gpt-5-mini",
    "mnemosyne": "gpt-5-mini"
  },
  "limits": {
    "monthlyRequests": null,
    "notes": "$20 API credit pool included. All models available to all paid plans — difference is pool size only."
  }
}
