{
  "plan": "claude-max-5x",
  "service": "claude",
  "tier": "max-5x",
  "price": "$100/mo",
  "models": {
    "fast": "anthropic/claude-haiku-4-5-20250514",
    "default": "anthropic/claude-sonnet-4-6-20250514",
    "premium": "anthropic/claude-opus-4-7-20250514"
  },
  "agent_overrides": {
    "apollo": "anthropic/claude-haiku-4-5-20250514",
    "iris": "anthropic/claude-haiku-4-5-20250514",
    "mnemosyne": "anthropic/claude-haiku-4-5-20250514",
    "talos": "anthropic/claude-haiku-4-5-20250514",
    "nyx": "anthropic/claude-haiku-4-5-20250514"
  },
  "limits": {
    "monthlyRequests": null,
    "notes": "5x Pro capacity. Priority access to Opus 4.7. ~225 messages per 5h window."
  }
}
