{
  "plan": "copilot-student",
  "service": "vscode",
  "tier": "student",
  "price": "$0 (verified students)",
  "models": {
    "fast": "openai/gpt-5-mini",
    "default": "anthropic/claude-sonnet-4-6",
    "premium": "anthropic/claude-opus-4-6"
  },
  "agent_overrides": {
    "apollo": "openai/gpt-5-mini",
    "nyx": "openai/gpt-5.4-mini",
    "talos": "openai/gpt-5.4-mini",
    "iris": "anthropic/claude-haiku-4-5",
    "mnemosyne": "anthropic/claude-haiku-4-5"
  },
  "limits": {
    "monthlyRequests": 300,
    "notes": "300 premium requests/mo for verified students. GPT-5.3-Codex available via auto-select only."
  }
}
