{
  "plan": "copilot-pro",
  "service": "vscode",
  "tier": "pro",
  "price": "$10/mo",
  "models": {
    "fast": "anthropic/claude-haiku-4-5",
    "default": "anthropic/claude-sonnet-4-6",
    "premium": "anthropic/claude-opus-4-6"
  },
  "agent_overrides": {
    "apollo": "openai/gpt-5-mini",
    "aphrodite": "google/gemini-3.1-pro",
    "nyx": "openai/gpt-5.4-mini",
    "talos": "openai/gpt-5.4-mini",
    "iris": "anthropic/claude-haiku-4-5",
    "mnemosyne": "anthropic/claude-haiku-4-5"
  },
  "handoff_models": {
    "zeus__themis": "anthropic/claude-opus-4-6",
    "zeus__mnemosyne": "openai/gpt-5.4-mini",
    "zeus__nyx": "openai/gpt-5.4-mini",
    "athena__themis": "anthropic/claude-opus-4-6",
    "hermes__themis": "anthropic/claude-opus-4-6",
    "aphrodite__themis": "anthropic/claude-opus-4-6",
    "demeter__themis": "anthropic/claude-opus-4-6",
    "prometheus__themis": "anthropic/claude-opus-4-6",
    "hephaestus__themis": "anthropic/claude-opus-4-6",
    "chiron__themis": "anthropic/claude-opus-4-6",
    "echo__themis": "anthropic/claude-opus-4-6",
    "iris__zeus": "openai/gpt-5.3-codex",
    "iris__mnemosyne": "anthropic/claude-haiku-4-5"
  },
  "limits": {
    "monthlyRequests": 300,
    "notes": "300 premium requests/mo. Models with 0x multiplier don't consume premium requests."
  }
}
